{
  "schema_version": "demoops.module_run.v1",
  "module_run_id": "run-director-media-001",
  "workflow_id": "workflow-001",
  "workflow_template_id": "interactive-application-v1",
  "module_id": "director-media",
  "module_version": "1.0.0",
  "attempt": 1,
  "state": "waiting_external",
  "phase": "provider_polling",
  "progress_percent": 62,
  "replay_policy": "idempotent_write",
  "waiting": {
    "reason_code": "provider_task_running",
    "owner": "provider",
    "next_operation": "resume_run",
    "expires_at": "2026-08-21T13:00:00Z"
  },
  "input_artifact_refs": [
    { "artifact_id": "recording-result-001", "revision": 1, "role": "recording_result" }
  ],
  "output_artifact_refs": [],
  "active_gate_refs": ["gate-provider-spend-001"],
  "checkpoint": {
    "checkpoint_id": "checkpoint-provider-001",
    "module_run_id": "run-director-media-001",
    "attempt": 1,
    "verified_phase": "provider_submitted",
    "external_task_ids": ["provider-task-001"],
    "artifact_refs": [],
    "once_effect_records": [
      {
        "effect_id": "provider-submit-001",
        "status": "confirmed",
        "idempotency_key": "workflow-001:provider-slot-001:attempt-1",
        "evidence_refs": ["evidence-provider-receipt-001"]
      }
    ],
    "replay_policy": "idempotent_write",
    "created_at": "2026-08-21T11:10:00Z"
  },
  "created_at": "2026-08-21T11:00:00Z",
  "updated_at": "2026-08-21T11:15:00Z",
  "started_at": "2026-08-21T11:01:00Z"
}
